rec,strength,evidenceQual,evidenceDots,textLiteral,guidelineURI,alsoSymptomatic
http://www.semanticweb.org/alicjamargraf/ontologies/2025/5/endometriosis#Rec78,strong,very low,1,"In adolescents with severe dysmenorrhea and/or endometriosis-associated pain, clinicians should prescribe hormonal contraceptives or progestogens (systemically or via LNG-IUS) as first line hormonal hormone therapy because they may be effective and safe. However, it is important to note that some progestogens may decrease bone mineral density.",https://www.eshre.eu/guideline/endometriosis#Rec78,true
http://www.semanticweb.org/alicjamargraf/ontologies/2025/5/endometriosis#Rec82,weak,very low,1,"In adolescents with endometriosis, clinicians may consider surgical removal of endometriosis lesions to manage endometriosis-related symptoms. However, symptom recurrence rates may be considerable, especially when surgery is not followed by hormone treatment.",https://www.eshre.eu/guideline/endometriosis#Rec82,true
http://www.semanticweb.org/alicjamargraf/ontologies/2025/5/endometriosis#Rec79,GPP,,,"The GDG recommends clinicians consider NSAIDs as treatment for endometriosis-associated pain in adolescents with (suspected) endometriosis, especially if first line hormone treatment is not an option.",https://www.eshre.eu/guideline/endometriosis#Rec79,true
http://www.semanticweb.org/alicjamargraf/ontologies/2025/5/endometriosis#Rec70,strong,very low,1,"In adolescents, clinicians should take a careful history to identify possible risk factors for endometriosis, such as a positive family history, obstructive genital malformations, early menarche, or short menstrual cycle.",https://www.eshre.eu/guideline/endometriosis#Rec70,false
http://www.semanticweb.org/alicjamargraf/ontologies/2025/5/endometriosis#Rec83,GPP,,,"The GDG recommends that if surgical treatment is indicated in adolescents with endometriosis, it should be performed laparoscopically by an experienced surgeon, and, if possible, complete laparoscopic removal of all present endometriosis should be performed.",https://www.eshre.eu/guideline/endometriosis#Rec83,false
http://www.semanticweb.org/alicjamargraf/ontologies/2025/5/endometriosis#Rec85,GPP,,,The GDG recommends that adolescents with endometriosis are informed of the potential detrimental effect of ovarian endometriosis and surgery on ovarian reserve and future fertility.,https://www.eshre.eu/guideline/endometriosis#Rec85,false
http://www.semanticweb.org/alicjamargraf/ontologies/2025/5/endometriosis#Rec86,GPP,,,"Fertility preservation options exist and the GDG recommends that adolescents are informed about them, although the true benefit, safety, and indications in adolescents with endometriosis remain unknown.",https://www.eshre.eu/guideline/endometriosis#Rec86,false
